{"$schema":"https://json-schema.org/draft/2020-12/schema","$id":"https://raw.githubusercontent.com/cyber-sentinel/Cyber-Sentinel-Atlas/main/schemas/ingestion/v1/normalizer-definition.schema.json","title":"NormalizerDefinition","type":"object","additionalProperties":false,"required":["ingestion_contract_version","normalizer_id","normalizer_version","status","purpose","psr_version","canonical_schema_version","identity_outcomes","network_access","ai_enabled"],"properties":{"ingestion_contract_version":{"$ref":"https://raw.githubusercontent.com/cyber-sentinel/Cyber-Sentinel-Atlas/main/schemas/ingestion/v1/defs/common.schema.json#/$defs/contract_version"},"normalizer_id":{"$ref":"https://raw.githubusercontent.com/cyber-sentinel/Cyber-Sentinel-Atlas/main/schemas/ingestion/v1/defs/common.schema.json#/$defs/artifact_id"},"normalizer_version":{"$ref":"https://raw.githubusercontent.com/cyber-sentinel/Cyber-Sentinel-Atlas/main/schemas/ingestion/v1/defs/common.schema.json#/$defs/semver"},"status":{"$ref":"https://raw.githubusercontent.com/cyber-sentinel/Cyber-Sentinel-Atlas/main/schemas/ingestion/v1/defs/common.schema.json#/$defs/status"},"purpose":{"type":"string","minLength":1},"psr_version":{"$ref":"https://raw.githubusercontent.com/cyber-sentinel/Cyber-Sentinel-Atlas/main/schemas/ingestion/v1/defs/common.schema.json#/$defs/semver"},"canonical_schema_version":{"type":"string","const":"1.0.0"},"identity_outcomes":{"type":"array","const":["CREATE","MATCH","AMBIGUOUS"]},"network_access":{"const":false},"ai_enabled":{"const":false}}}
