{"ingestion_contract_version":"1.0.0","normalizer_id":"atlas:normalizer:atlas.ingestion:mitre-d3fend","normalizer_version":"1.0.0","status":"active","purpose":"Normalize MITRE D3FEND defensive-technique PSR records into canonical candidate entities and source-backed definition claims using a pinned mapping profile.","psr_version":"1.0.0","canonical_schema_version":"1.0.0","identity_outcomes":["CREATE","MATCH","AMBIGUOUS"],"network_access":false,"ai_enabled":false}
